{
  "protocol_version": "0.1",
  "schema": "localize-anything-document-decision-log-record-v1",
  "run_id": "doc-decision-example-001",
  "decision_id": "document-decision-example",
  "decision_type": "confirm_metric_boundary",
  "reviewer_role": "document_owner",
  "reviewer_reference": "owner@example.test",
  "source_artifact_references": ["claim-metric-report.json"],
  "affected_segment_ids": ["s1"],
  "affected_scope": { "scope_type": "limited", "segments": ["s1"] },
  "related_open_decision_id": null,
  "related_claim_metric_risk_id": "claim-metric-s1",
  "related_publicity_risk_id": null,
  "related_semantic_alignment_id": null,
  "decision_status": "accepted_with_limitations",
  "decision_rationale": "Metric wording is accepted for this document section only.",
  "accepted_limitation": "limited to the reviewed institutional publicity case",
  "required_follow_up": null,
  "effective_scope": { "scope_type": "limited", "segments": ["s1"] },
  "created_at": "2026-06-29T00:00:00Z",
  "supersedes": [],
  "superseded_by": []
}
